status_id,status_message,link_name,status_type,status_link,status_published,num_reactions,num_comments,num_shares,num_likes,num_loves,num_wows,num_hahas,num_sads,num_angrys,num_special
253591661347566_1913719745334741,"Searches for DIY ornaments are up +53% on Pinterest.

Find more top trending ideas to try for the holidays: https://pin.it/7C_xHfA",eHow,video,https://www.facebook.com/eHow/videos/10155388993561026/,2017-12-06 14:20:37,3596,239,0,3056,477,58,3,0,1,1
253591661347566_1912161798823869,"Nothing beets these healthy smoothie recipes.

Save Pin for later: https://pin.it/busjewhtmq4r33",Goodful,video,https://www.facebook.com/officialgoodful/videos/1866382403432217/,2017-12-05 13:31:35,1142,131,0,1032,86,20,1,1,1,1
253591661347566_1910771962296186,"Because it's #NationalCookieDay. 🍪 🍪 🍪 

Save Pin for later: https://pin.it/tkznmlolun6uue",Food Network,video,https://www.facebook.com/FoodNetwork/videos/10155277539956727/,2017-12-04 16:00:00,664,115,0,563,58,40,1,1,0,1
253591661347566_1910766455630070,"Yes, there are Andes mints on top. #NationalCookieDay
via Real Simple",This Is the Most Popular Christmas Cookie on Pinterest,link,https://www.realsimple.com/food-recipes/recipe-collections-favorites/desserts/most-popular-christmas-cookie-pinterest,2017-12-04 13:38:54,97,9,21,90,6,0,0,0,0,1
253591661347566_1906442046062511,"Green, gold and festive all over🎄🎄🎄

Save Pin for later: https://pin.it/luqkz6cizlhb2p",eHow,video,https://www.facebook.com/eHow/videos/10155365571396026/,2017-12-03 20:00:01,584,57,0,541,34,9,0,0,0,0
253591661347566_1906432286063487,"Searches for DIY ornaments are up +53% on Pinterest.

Find more top trending ideas to try for the holidays: https://pin.it/7C_xHfA",LittleThings,video,https://www.facebook.com/littlethingscom/videos/476222962587081/,2017-12-03 12:00:01,392,92,0,354,31,7,0,0,0,0
253591661347566_1904993629540686,"Easy and healthy breakfast, lunch or snack. 

Save Pin for later: https://pin.it/5r5x232jkbcdgw",Tasty Junior,video,https://www.facebook.com/tastyjunior/videos/537705963250162/,2017-12-02 17:00:01,218,14,0,194,18,5,1,0,0,0
253591661347566_1906675042705878,"""I use Pinterest for inspiration and to stay current. As a furniture designer, Pinterest helps me find and save design styles that I love. My design boards expose me to so much other stuff—sculpture, a redwood tree, vintage National Geographic photos. I try to look at these Pins in a deeper way and pull what I see into my projects."" -Sabin in Los Angeles, California. 

See the Pins that inspire him: https://pin.it/kvikx53ev2eez4",,photo,https://www.facebook.com/pinterest/photos/a.446866188686778.114935.253591661347566/1906674722705910/?type=3,2017-12-02 12:00:01,193,8,6,181,12,0,0,0,0,0
253591661347566_1906462219393827,"Holiday parties are the perfect excuse for extra shimmer. Searches for gold eyeliner looks are up +722% on Pinterest. 
via HuffPost","This Is The No. 1 Holiday Beauty Trend Of The Year, Says Pinterest",link,https://www.huffingtonpost.com/entry/this-is-the-1-holiday-beauty-trend-of-the-year-says_us_5a14874ae4b009b331ad7551,2017-12-01 17:00:03,116,11,12,114,1,0,0,0,0,1
253591661347566_1906449312728451,"What if you tried a new recipe this weekend? 

Save Pin for later: https://pin.it/ezmjjsxq5jg3ys",Preppy Kitchen,video,https://www.facebook.com/PreppyKitchen/videos/1836408039723979/,2017-12-01 14:37:18,257,39,0,216,27,13,0,1,0,0
253591661347566_1904741106232605,Merry everything! 🎄🎅🎁,Brit + Co,photo,https://www.facebook.com/britandco/photos/a.248424585220998.60653.201553549908102/1639145892815520/?type=3,2017-11-30 17:00:01,667,28,0,602,54,9,1,0,0,1
253591661347566_1904727586233957,"'Tis the Season!

Find more top trending ideas to try for the holidays: https://pin.it/7C_xHfA",eHow,video,https://www.facebook.com/eHow/videos/10155368668631026/,2017-11-30 14:01:45,13880,2639,1,11071,2043,209,541,11,3,2
253591661347566_1903104399729609,"These recipes are so good, you won't miss the carbs.

Save Pin for later: https://pin.it/c6bg4irrg44ofz",Goodful,video,https://www.facebook.com/officialgoodful/videos/1839902979413493/,2017-11-29 13:20:28,1926,202,1,1766,119,38,2,0,1,0
253591661347566_1901845963188786,"Saves for sequined jackets are up +229% on Pinterest.  
via Glamour",The Party-Ready Trend That's Blowing Up on Pinterest,link,https://www.glamour.com/gallery/how-to-wear-sequin-jackets,2017-11-28 17:20:58,133,12,9,122,5,2,3,0,0,1
253591661347566_1899543603419022,"Goodbye grease stains. 

Save Pin for later: https://pin.it/kdx6qbe5axwcwj",eHow,video,https://www.facebook.com/eHow/videos/10155345711236026/,2017-11-27 13:39:16,638,38,0,588,24,25,0,1,0,0
253591661347566_1881486635224719,"From all of us at Pinterest, THANK YOU and happy #Thanksgiving.","Many, many thanks!",link,https://www.pinterest.com/pinterest/many-many-thanks/,2017-11-23 12:00:01,306,59,5,275,31,0,0,0,0,0
253591661347566_1889486064424776,"Try something different this Thanksgiving 🍽🍽🍽

Save Pin for later: https://pin.it/qomw3xtcqiy2vz",Nifty,video,https://www.facebook.com/buzzfeednifty/videos/1969390233315699/,2017-11-22 17:00:01,488,28,2,447,32,9,0,0,0,0
253591661347566_1881483455225037,"No room in the oven for dessert? Try this no bake pumpkin cheesecake. 
#whatifwednesday

Find more top trending Holiday recipes and ideas to try: https://pin.it/7C_xHfA",Tasty Vegetarian,video,https://www.facebook.com/tastyvegetarian/videos/1943393222589225/,2017-11-22 13:00:00,1082,87,0,984,75,22,0,0,1,0
253591661347566_1881460291894020,"You can still pack a lot of punch in mini-bites. Try this twist on a classic Thanksgiving side. 

More top trending Holiday recipes and ideas: https://pin.it/7C_xHfA",Forkly,video,https://www.facebook.com/forklyfood/videos/10154770312301246/,2017-11-21 13:00:01,851,94,0,785,43,21,1,0,0,1
253591661347566_1881457511894298,💅💅💅,Allure,link,http://in.allure.com/QtlscOf,2017-11-21 09:00:01,409,21,0,381,24,4,0,0,0,0
253591661347566_1881456591894390,"Have you tried this?
via The Kitchn",The Most Popular Green Bean Casserole Recipe on Pinterest,link,http://www.thekitchn.com/the-most-popular-green-bean-casserole-on-pinterest-251067,2017-11-20 21:00:01,275,31,171,261,14,0,0,0,0,0
253591661347566_1881448848561831,"Add this one to your Thanksgiving menu. 

Find more top trending recipes and ideas to try for the holidays: https://pin.it/7C_xHfA",Food Network,video,https://www.facebook.com/FoodNetwork/videos/10155241826726727/,2017-11-20 11:00:01,655,121,0,586,53,16,0,0,0,0
253591661347566_1888181844555198,"Get crackin'! 

Save Pin for later: https://pin.it/tjhjjkdwnlhzk3",Tasty,video,https://www.facebook.com/buzzfeedtasty/videos/2111218002464171/,2017-11-19 16:29:14,5604,825,0,4924,351,309,20,0,0,0
253591661347566_1885198478186868,"""I had so many different holiday events that were going to be with totally different groups of people. I wanted something that was really fun and on trend but also very versatile. I really wanted a leather skirt, but I needed to make sure I could actually wear it. I went to Pinterest and I just started pouring through different outfit ideas.""-Julia, lover of food, wine and people (preferably together), saving ideas for style and dinner parties on Pinterest. 

Check out her profile: https://pin.it/oa2ehmlchezwmu",,photo,https://www.facebook.com/pinterest/photos/a.446866188686778.114935.253591661347566/1885198048186911/?type=3,2017-11-18 12:00:00,146,16,4,139,6,0,0,0,1,0
253591661347566_1883990278307688,"You can still pack a lot of punch in mini-bites.

Find more top trending Holiday recipes and ideas in our latest holi-YAY report: https://pin.it/7C_xHfA",Spoon University,video,https://www.facebook.com/SpoonUniversity/videos/1461038770591689/,2017-11-16 21:00:01,275,12,0,251,18,6,0,0,0,0
253591661347566_1883868748319841,"Give your show-stopping meal the right ambiance.

Find more tablescape ideas to try on Pinterest: https://pin.it/csew52vl3eszu2",eHow,video,https://www.facebook.com/eHow/videos/10155333080266026/,2017-11-16 14:35:15,191,14,0,173,16,1,0,0,1,0
253591661347566_1881410688565647,Saves for this 90s grunge staple are up +318% on Pinterest.,PureWow,link,https://www.purewow.com/fashion/fishnet-outfit-ideas?utm_medium=social&utm_source=facebook&utm_campaign=organic&utm_content=main&utm_term=now,2017-11-14 19:14:01,241,65,0,203,18,6,12,1,1,0
253591661347566_1881114295261953,"An entire pumpkin pie in ONE bite! 

More top trending Holiday recipes and ideas to try: https://pin.it/7C_xHfA",Tip Hero,video,https://www.facebook.com/tiphero/videos/10154368779258761/,2017-11-14 17:00:01,1869,81,1,1710,131,27,1,0,0,0
253591661347566_1879753935397989,"Try this crowd-pleasing holiday favorite the classic way. 

Find more top trending Holiday recipes and ideas in our latest holi-YAY report: https://pin.it/7C_xHfA",Chef In Training,video,https://www.facebook.com/ChefinTrainingBlog/videos/1636264406393678/,2017-11-13 15:00:00,310,29,0,280,25,5,0,0,0,0
253591661347566_1879581025415280,Trending on Pinterest in beauty.,Allure,link,http://in.allure.com/wBkVDOA,2017-11-13 09:38:21,364,16,0,340,23,1,0,0,0,0
253591661347566_1878787735494609,"Fast and tasty doesn't have to mean time-consuming.

Save Pin for later: https://pin.it/Wx2am8g",Tasty Junior,video,https://www.facebook.com/tastyjunior/videos/519186598435432/,2017-11-12 18:35:27,3803,260,1,3553,202,32,6,4,6,0
253591661347566_1876039802436069,"""A while ago, I was scrolling through my home feed and there was a Pin that had this really cool haircut, a sort of pixie crop, and it had written underneath it, ""If only I had short fine hair I would have this haircut."" I thought, “I have fine, kind of rubbish hair, maybe I can try this haircut.” I had never considered a pixie cut before, so I Pinned like a million other haircuts. Then I actually printed them, took them into the hairdresser and got my haircut. I loved it."" --Kristy in Edinburgh, Scotland. 

See the board that inspired Kristy to try something new: https://pin.it/g-edFXe",,photo,https://www.facebook.com/pinterest/photos/a.446866188686778.114935.253591661347566/1876038185769564/?type=3,2017-11-11 12:17:01,247,25,8,233,12,0,2,0,0,0
253591661347566_1875873539119362,"You’re going to want to try this...
via Refinery29",Pinterest Searches Are Up 1066% For This Thanksgiving Dish,link,http://www.refinery29.com/2017/11/179092/most-popular-thanksgiving-recipe-pinterest,2017-11-10 14:09:33,160,11,23,152,6,0,1,0,1,0
253591661347566_1874720689234647,"Delicious, creamy mashed potatoes? Bam. 

Find more top trending Holiday recipes and ideas in our latest holi-YAY report: https://pin.it/7C_xHfA",Food Network,video,https://www.facebook.com/FoodNetwork/videos/10155221721241727/,2017-11-09 21:00:00,1162,129,0,1049,90,20,2,1,0,0
253591661347566_1874560329250683,"Say good-bye to your crinkly, balled-up linens once and for all. 

Save on Pinterest for later: https://pin.it/oltL1aR",eHow,video,https://www.facebook.com/eHow/videos/10155233575801026/,2017-11-09 14:27:31,865,199,0,761,48,43,13,0,0,0
253591661347566_1874429629263753,"Starting today, we’re rolling out a new way to organize your Pins—board sections— just in time for holiday planning! Head over to your profile to start organizing, and let us know how you’re using sections below.",A new way to organize your ideas on Pinterest,link,https://blog.pinterest.com/en/new-way-organize-your-ideas-pinterest,2017-11-09 12:17:07,172,68,42,151,11,0,1,2,7,0
253591661347566_1873204172719632,"Tis the season of pumpkin spice .... everything.

Save pin for later: https://pin.it/4til2EH",Tasty,video,https://www.facebook.com/buzzfeedtasty/videos/2091232687796036/,2017-11-08 16:00:01,3734,567,3,3268,321,137,2,2,1,3
253591661347566_1873159776057405,"Everything you need for a holi-YAY celebration. 
via Food & Wine",The 6 Biggest Christmas Decorating Trends This Year According to Pinterest,link,http://www.foodandwine.com/syndication/pinterest-christmas-trend-report-2017-187197,2017-11-08 13:37:31,189,8,37,180,6,1,1,0,1,0
253591661347566_1871788736194509,"Try this guilt-free twist on a holiday favorite. 

Find more top trending Holiday recipes and ideas in our latest holi-YAY report: https://pin.it/7C_xHfA",eHow,video,https://www.facebook.com/eHow/videos/10155294414931026/,2017-11-07 21:00:01,188,47,0,177,7,3,0,1,0,0
253591661347566_1871777979528918,Get set for winter with the latest trends on Pinterest.,Now trending on Pinterest,link,https://blog.pinterest.com/en/win-winter-23-trends-do-it,2017-11-07 15:00:02,65,10,3,62,3,0,0,0,0,0
253591661347566_1871701269536589,"Looking for a Christmas tree alternative?
Searches for Pineapple Christmas trees are up +3406% YoY on Pinterest.
via Delish","Pineapple ""Christmas Trees"" Are Our Favorite New Way to Celebrate This Season",link,http://www.delish.com/food/a56483/pineapple-christmas-trees/,2017-11-07 12:18:24,4041,2901,2277,3126,500,25,388,0,2,0
253591661347566_1870517712988278,"Nacho average weeknight dinner. 
#NationalNachosDay",Kitchen Crafty Fun,video,https://www.facebook.com/KitchenCraftyFun/videos/10154647169596039/,2017-11-06 15:30:01,753,83,0,681,63,9,0,0,0,0
253591661347566_1870197313020318,"Try one of these DIY rug ideas to brighten up your home. 

Save Pin for later: https://pin.it/kja2VNk",Nifty,video,https://www.facebook.com/buzzfeednifty/videos/1950220561899333/,2017-11-06 09:28:09,4362,206,0,3919,326,108,7,0,2,0
253591661347566_1866772376696145,"""I grew up antiquing a lot with my mom and my grandmother. And there was something really fun about just going around seeing furniture with history and seeing how that could change a space. I don't think I antique quite so much anymore, but I think there's just something really fun about browsing and trying to find something different out there, something unique and that's where Pinterest is a great tool, for me.""--Brooke in Seattle, Washington. 

See where she gets her inspiration: https://pin.it/F3e6EZq",,photo,https://www.facebook.com/pinterest/photos/a.446866188686778.114935.253591661347566/1866771926696190/?type=3,2017-11-04 12:00:00,278,57,13,261,14,1,0,0,1,1
253591661347566_1866779803362069,Teddy jacket saves are up more than +1200% YoY on Pinterest.,"According To Pinterest, This Is The Coat Trend You NEED This Fall",link,http://www.refinery29.com/2017/10/176867/pinterest-2017-popular-teddy-bear-coat-trend,2017-11-03 16:26:30,111,39,15,97,7,0,5,0,2,0
253591661347566_1865575070149209,"What if you tried making it instead? 
Searches for candle making are up +58% on Pinterest.

Save Pin for later: https://pin.it/VdlwXEb",eHow,video,https://www.facebook.com/eHow/videos/10155250613316026/,2017-11-02 18:15:52,6715,1130,1,5922,621,163,7,0,2,0
253591661347566_1863979180308798,"People are going for bold, colorful looks when it comes to their hair and makeup. Searches for blue mascara are up +234% YoY.",BLINK Beauty,video,https://www.facebook.com/blink/videos/497592730607214/,2017-11-02 11:46:00,151,39,0,123,13,7,3,3,2,0
253591661347566_1863964020310314,Holi-YAY! The trend list to get you through this superfestive-but-sometimes-stressful season.,Holiday trends on Pinterest,link,https://blog.pinterest.com/en/2017-holi-yay-trend-report-aka-very-nice-list,2017-11-01 11:19:06,134,33,18,125,5,3,1,0,0,0
253591661347566_1862754497097933,"Last min costume ideas you can throw together in a pinch. 
via Real Simple",These Mesmerizing Halloween Makeup Looks Are Trending on Pinterest,link,https://www.realsimple.com/holidays-entertaining/holidays/halloween/best-halloween-makeup-pinterest,2017-10-31 13:26:41,92,9,5,88,4,0,0,0,0,0
253591661347566_1861555867217796,"Creep your peeps with these Halloween treats. 👻👻👻

Save Pin for later: https://pin.it/pygoypV",Nifty,video,https://www.facebook.com/buzzfeednifty/videos/1956954804559242/,2017-10-30 16:00:01,3290,360,4,2850,258,141,35,1,4,1
253591661347566_1861352583904791,"Need a last minute costume? Try one of these. 
via Try Living With Lucie Refinery29",5 Days Of DIY Halloween Costumes,video,https://www.youtube.com/watch?v=5otKiSs3AeY&t=199s,2017-10-30 11:50:35,65,4,12,62,2,1,0,0,0,0
253591661347566_1853232644716785,"""I was looking on Pinterest one day for general beauty stuff and I came across this pin about fall trends.... It had this model and she had green eye shadow all around her eye and a glossy nude lip and it was really striking to me because they used a black model. The jewel tone looked amazing on her skin so I was wondering why haven't I tried that. I can try that too. It definitely became a mainstay in my arsenal which I love and folded it into my life""--Brittany, from Brooklyn, New York.

See the Hair & Beauty board that inspires her to try new things: https://pin.it/bwOBN37",,photo,https://www.facebook.com/pinterest/photos/a.446866188686778.114935.253591661347566/1853227911383925/?type=3,2017-10-28 11:02:00,187,24,6,172,15,0,0,0,0,0
253591661347566_1857687124271337,Celebrate your favorite Netflix series return with these epic Stranger Things inspired bites. 🙃,Stranger Things viewing party,link,https://www.pinterest.com/pinpicks/stranger-things-viewing-party/,2017-10-27 19:17:04,137,17,15,123,13,0,1,0,0,0
253591661347566_1852056254834424,"If you’re too old for traditional trick-or-treating, you can still get in on the fun. 🐸🐸🐸

Find more top trending Halloween ideas to try in our Pinfrights report: http://pin.it/JgW-OSE",eHow,video,https://www.facebook.com/eHow/videos/10155255986871026/,2017-10-27 16:00:01,159,15,0,139,9,5,6,0,0,0
253591661347566_1852049311501785,"Take a stab at these witch-crafty ideas.

Save Pin for later: https://pin.it/hCOkdHY",Nifty,video,https://www.facebook.com/buzzfeednifty/videos/1953244071596982/,2017-10-26 11:00:01,3598,514,1,3205,239,40,114,0,1,-1
253591661347566_1852045078168875,"See what people are loving from Food Network.
Save Pin for later: https://pin.it/IMRD-R9",Food Network,video,https://www.facebook.com/FoodNetwork/videos/10155180240791727/,2017-10-25 18:19:02,448,25,0,424,20,2,1,0,0,1
253591661347566_1853552664684783,"How will you haunt your house? 

Find more top trending Halloween ideas to try in our latest Pinfrights report: http://pin.it/JgW-OSE",Live with Kelly and Ryan,video,https://www.facebook.com/LiveKellyandRyan/videos/10155253368303472/,2017-10-24 18:51:42,82,18,0,78,4,0,0,0,0,0
253591661347566_1853419288031454,"💅💅💅
via Byrdie",These 5 Nail Polishes Are The Most Popular Fall Shades on Pinterest,link,http://www.byrdie.com/pinterest-fall-nail-color/slide5,2017-10-24 16:38:33,758,45,113,714,43,0,1,0,0,0
253591661347566_1852029191503797,"Eat, drink and be scary 💀💀💀

Find more top trending Halloween ideas to try in our latest Pinfrights report: http://pin.it/JgW-OSE",RSVP,video,https://www.facebook.com/Refinery29RSVP/videos/1725052194180600/,2017-10-23 17:52:28,493,160,0,402,36,21,33,1,0,0
253591661347566_1851842451522471,"Whether you need a group getup, canine costume or pretty creepy makeup, we’ve got you covered.
via InStyle",Need Halloween Inspiration? We've Got Your Best Costume Yet,link,http://www.instyle.com/holidays-occasions/halloween/halloween-costume-ideas,2017-10-23 14:37:47,104,9,16,95,6,1,2,0,0,0
253591661347566_1843866435653406,"Halloween decorations that are so easy, it’s scary.

Find more top trending Halloween ideas to try in our latest Pinfrights report: http://pin.it/JgW-OSE",eHow,video,https://www.facebook.com/eHow/videos/10155173189156026/,2017-10-22 12:00:00,204,26,0,184,7,3,9,0,1,0
253591661347566_1843872522319464,"Pumpkin & cheesecake: Relationship goals 🎃🎃🎃
#nationalpumpkincheesecakeday

Save Pin for later: https://pin.it/d7cYWw9",Delish,video,https://www.facebook.com/delish/videos/10155818296667437/,2017-10-21 17:00:00,3743,663,2,3284,338,117,2,2,0,0
253591661347566_1843882798985103,"“I'm really bad at cooking so I don't try a lot of recipes, except this avocado grilled cheese. I had all the ingredients, went for it and it was good!”—Guillaume in Paris, grilled cheese whiz, saving brunch sandwiches on Pinterest. 

See the Pins that inspired him to try something new: https://pin.it/6PC0LEO",,photo,https://www.facebook.com/pinterest/photos/a.446866188686778.114935.253591661347566/1843882598985123/?type=3,2017-10-21 11:07:00,143,11,5,133,10,0,0,0,0,0
253591661347566_1847929728580410,"Trending on Pinterest in home: Velvet, blush & macrame accents.",Domino Magazine,link,https://domino.com/fall-decor-trends-2017,2017-10-20 14:00:00,74,5,0,71,0,0,2,0,0,1
253591661347566_1843888158984567,"Costumes that are creeping it real.

Find more top trending Halloween ideas to try in our latest Pinfrights report: http://pin.it/JgW-OSE",Top Knot,video,https://www.facebook.com/buzzfeedtopknot/videos/1715255361880507/,2017-10-20 12:00:00,1855,311,0,1458,203,186,4,0,4,0
253591661347566_1846567695383280,"Pro tip: Great game to play at your Halloween party. 

Find more top creepy Halloween treats to try in our latest Pinfrights report: http://pin.it/JgW-OSE",eHow,video,https://www.facebook.com/eHow/videos/10155258140891026/,2017-10-19 15:10:51,137,18,0,89,3,0,45,0,0,0
253591661347566_1843891108984272,"Dying for ideas? We've got you covered.
via HGTV","We've Got the Top Halloween Decor, Food + Costume Trends From Pinterest",link,http://www.hgtv.com/design/make-and-celebrate/holidays/halloween-pinterest-trends-2017,2017-10-19 11:00:02,150,10,33,137,5,0,7,0,0,1
253591661347566_1845239828849400,"Halloween decorations that are so easy, it’s scary. 

Save Pin for later: https://pin.it/Eua9yz5",TODAY Home,video,https://www.facebook.com/todayhome/videos/1447826165338973/,2017-10-18 13:04:13,84,8,0,78,6,0,0,0,0,0
253591661347566_1843862758987107,Searches for camping hacks are up +77% on Pinterest.,Nifty Outdoors,video,https://www.facebook.com/buzzfeedniftyoutdoors/videos/308130349663823/,2017-10-17 19:00:01,8804,1157,4,7934,621,234,9,3,2,1
253591661347566_1844005792306137,"Pinterest is partnering with the Sonoma Humane Society, Rocket Dog Rescue, and the local businesses of Sonoma and Napa counties to make sure the relief victims receive the donations that are needed the most. 

Get involved: https://www.amazon.com/gp/registry/wishlist/5S0O2HTZ3J1X/ref=nav_wishlist_lists_1",Sonoma Humane Society,photo,https://www.facebook.com/SonomaHumane/photos/a.149865955106037.33838.102288989863734/1493435140749105/?type=3,2017-10-17 13:41:01,242,9,0,194,42,6,0,0,0,0
253591661347566_1843858025654247,"Celebrate #NationalPastaDay with this Food Network favorite. 

Save Pin for later: https://pin.it/0SIG1Tz",Food Network,video,https://www.facebook.com/FoodNetwork/videos/10154932215111727/,2017-10-17 11:33:50,2292,272,0,2053,177,54,1,5,2,0
253591661347566_1842958885744161,"Whether you need a group getup, canine costume or pretty creepy makeup, we’ve got you covered.
via COVETEUR",2017’s Most Popular Halloween Costumes on Pinterest,link,http://coveteur.com/2017/10/08/pinterest-most-popular-halloween-costumes-2017/?utm_source=facebook&utm_campaign=domino&utm_medium=social,2017-10-16 18:22:45,113,10,14,108,3,2,0,0,0,0
253591661347566_1837242232982493,"Eat, drink and be creepy.

Find more top trending Halloween ideas to try in our latest Pinfrights report: http://pin.it/JgW-OSE",eHow,video,https://www.facebook.com/eHow/videos/10155250562441026/,2017-10-15 20:00:00,9757,4118,7,4756,281,542,4157,7,12,2
253591661347566_1837268382979878,"No tortillas? No problem.

Save Pin for later: http://pin.it/Zn2vwdQ",Food Network,video,https://www.facebook.com/FoodNetwork/videos/10154812847036727/,2017-10-14 18:00:00,919,95,0,862,42,12,1,0,1,1
253591661347566_1837238122982904,"""I discovered that I really like shoes, like men's shoes. I never thought that would happen. I was visiting my men's style board on Pinterest and I noticed there were a lot of boots. So, I bought something similar. That was a Pinterest revelation for me."" -Pablo in Buenos Aires, Argentina.

See where Pablo gets his style inspiration: http://pin.it/8Q7uA6D",,photo,https://www.facebook.com/pinterest/photos/a.446866188686778.114935.253591661347566/1837237226316327/?type=3,2017-10-14 11:04:00,115,13,2,109,2,3,1,0,0,0
253591661347566_1834785683228148,"Nom nom nom.
Searches for game day food ideas are up +29%. 

Save on Pinterest for later: http://pin.it/ZMcGVTH",Tasty,video,https://www.facebook.com/buzzfeedtasty/videos/2053529228233049/,2017-10-12 14:04:00,5156,642,1,4598,384,166,3,1,0,4
253591661347566_1837108272995889,"How will you haunt your house? 
via PopSugar",The 11 Best Halloween Decor Ideas on Pinterest,link,https://www.popsugar.com/home/Pinterest-Halloween-Decor-2017-44082577,2017-10-12 09:48:17,232,31,32,220,11,0,0,0,0,1
253591661347566_1836303383076378,"People search and save +200 million Halloween ideas on Pinterest. Creep out your guests with this ghoulish goody. 

Save Pin for later: http://pin.it/AkeqOmW",eHow,video,https://www.facebook.com/eHow/videos/10155238618386026/,2017-10-11 18:09:07,2648,5026,1,988,43,694,728,77,117,1
253591661347566_1835084576531592,"Searches for kitchen organization are up +58% on Pinterest.

Save Pin for later: http://pin.it/ljFACve",Goodful,video,https://www.facebook.com/officialgoodful/videos/1713563012047491/,2017-10-10 20:00:00,5511,281,0,4946,411,146,8,0,0,0
253591661347566_1834982633208453,"Trending on Pinterest in Halloween costumes. 
via Refinery29",Pinterest Searches Are Up 1200% For This Halloween Costume,link,http://www.refinery29.com/2017/10/175574/pinterest-halloween-makeup?utm_source=facebook.com&utm_medium=post,2017-10-10 16:40:33,167,20,23,156,5,1,2,1,1,1
253591661347566_1833520006688049,Need a new trend to go with the new weather?,Fresh fall trends for October are here! You’re going to want to try at least one...,link,https://blog.pinterest.com/en/new-trends-because-finally-it-feels-fall,2017-10-09 15:06:54,146,11,7,137,8,0,0,0,0,1
