status_id,status_message,link_name,status_type,status_link,status_published,num_reactions,num_comments,num_shares,num_likes,num_loves,num_wows,num_hahas,num_sads,num_angrys,num_special
7177913734_10155915333173735,"From Person of the Year to Person of the Internet... This week, TIME compiled a list of the top five ordinary people who hit the front page of Reddit in 2017: time.com/5026623/viral-people-2017-reddit/",5 Ordinary People Who Captured the Internet's Heart in 2017,link,http://time.com/5026623/viral-people-2017-reddit/,2017-11-30 14:59:04,358,5,15,317,23,0,17,0,1,0
7177913734_10155912763743735,"This morning, u/aishovoya posted a touching story, with a very specific request, to r/pics. 

""[My brother is] mentally and physically disabled and the only thing he wants for Christmas is a Blue Police Hummer truck, made in 2000. ... Which would be a lot easier if they weren't produced in 2000. And if we hadn't bought every other one on EBay for the last 17 years,"" u/aishovoya wrote. ""If anyone has one of these in their attics, please throw it on eBay!"" 

A few hours and 100,000+ upvotes later, redditors caught Tonka's attention, and they're now working on getting OP's brother the blue hummers from 2000! 

redd.it/7gdfvm",Tonka,link,https://imgur.com/a/XF90I,2017-11-29 16:28:01,2809,61,0,1971,810,28,0,0,0,0
7177913734_10155912440598735,"""A student gave me a koozie for my apples.""

Posted on r/mildlyinteresting by u/tony_flamingo: redd.it/7gd1pm",,photo,https://www.facebook.com/reddit/photos/a.10150220507938735.343687.7177913734/10155912439348735/?type=3,2017-11-29 14:11:38,289,19,6,234,22,0,33,0,0,0
7177913734_10155909344193735,"""I hold over six Guinness World Records for the largest bonfire, the longest motorcycle, the fastest speed on a mobility scooter, the fastest pram and the fastest toilet. AMA!""

—Colin furze on r/IAmA: redd.it/7g5gky",,photo,https://www.facebook.com/reddit/photos/a.10150220507938735.343687.7177913734/10155909341873735/?type=3,2017-11-28 13:25:16,151,12,5,136,9,2,4,0,0,0
7177913734_10155907164763735,"Tomorrow, join us at our San Francisco office for a night of lightning talks from leading women in the tech industry specializing in machine learning and data science!

RSVP here: facebook.com/events/130070814344312/",Women Talk Tech at Reddit,event,https://www.facebook.com/events/130070814344312/,2017-11-27 18:59:10,75,4,0,69,6,0,0,0,0,0
7177913734_10155906504023735,"Today on r/blog, our CEO Steve Huffman is calling on redditors to share why net neutrality is important to them. 

Read his post and add your voice to the comments here: redd.it/7fx1x4",An update on the fight for the free and open internet • r/blog,link,https://redd.it/7fx1x4,2017-11-27 13:47:27,401,14,66,378,16,2,4,1,0,0
7177913734_10155896303678735,"Turkeys covered in Flaming Hot Cheetos, adorable rescue pets, a surge of Net Neutrality activism, and more—it's all in our Thanksgiving cornucopia of content on the blog!

redditblog.com/2017/11/22/a-very-reddit-thanksgiving/",A Very Reddit Thanksgiving,link,http://redditblog.com/2017/11/22/a-very-reddit-thanksgiving/,2017-11-23 21:07:33,67,3,2,58,4,0,5,0,0,0
7177913734_10155890049033735,"""Our new stray day-dreaming of her first Thanksgiving""

Posted on r/aww by u/kyleisftw: redd.it/7d60v4",,photo,https://www.facebook.com/reddit/photos/a.10150220507938735.343687.7177913734/10155890047508735/?type=3,2017-11-21 20:27:16,2035,123,62,1631,366,2,34,0,0,2
7177913734_10155889208258735,It's time for the 8th Annual Reddit Gifts Secret Santa gift exchange! Sign up before November 29 at redditgifts.com/exchanges/secret-santa-2016,Reddit,photo,https://www.facebook.com/reddit/photos/a.468608253734.273425.7177913734/10154696310963735/?type=3,2017-11-21 14:16:31,700,38,31,643,45,7,5,0,0,0
7177913734_10155889207113735,"Sign up for Secret Santa 2017, brought to you by Reddit Gifts! redditgifts.com/exchanges/manage/#/status/secret-santa-2017/",Reddit's cover photo,photo,https://www.facebook.com/reddit/photos/a.10151293207833735.518099.7177913734/10155889206798735/?type=3,2017-11-21 14:16:00,104,6,6,98,4,0,2,0,0,0
7177913734_10155889135553735,"ICYMI, last night Seth Rogen and Evan Goldberg did an AMA, answering questions about Pineapple Express 2, having cool moms, their new show Future Man, finger legs, and more!

Check it out: redd.it/7ee1fx",,photo,https://www.facebook.com/reddit/photos/a.10150220507938735.343687.7177913734/10155889123433735/?type=3,2017-11-21 13:41:08,753,37,20,610,14,0,128,0,0,1
7177913734_10155887248293735,"Seth Rogen & Evan Goldberg are BACK for another AMA! 

LIVE on r/IAmA: reddit.com/r/IAmA/comments/7ee1fx/were_seth_rogen_and_evan_goldberg_here_to_talk",Future Man,photo,https://www.facebook.com/futuremanonhulu/photos/a.304469349912822.1073741828.304330563260034/513666508993104/?type=3,2017-11-20 20:12:00,146,8,0,132,9,1,3,0,0,1
7177913734_10155886670593735,"""Hi Reddit! I'm Francesca Marie Smith, the voice of Helga Pataki on Hey Arnold! AMA!""

LIVE on r/IAmA! redd.it/7ebnlf",,photo,https://www.facebook.com/reddit/photos/a.10150220507938735.343687.7177913734/10155886666218735/?type=3,2017-11-20 16:09:39,469,19,11,398,40,20,6,0,0,5
7177913734_10155886519483735,"There's just one week left to sign up for Reddit Gifts Secret Santa 2017!

If you're new to Secret Santa-ing, the RG team made a handy video to walk you through it. Sign-ups here: redditgifts.com/exchanges/manage/#/status/secret-santa-2017/",Reddit Gifts,video,https://www.facebook.com/redditgifts/videos/1698922443460624/,2017-11-20 15:01:05,94,12,0,89,4,0,1,0,0,0
7177913734_10155886345518735,"Seth Rogen & Evan Goldberg are back for another AMA *today* at 5:30 PM PST! 

Stay tuned... reddit.com/r/IAmA

(And if you caught the debut of their new show Future Man last week, it already has its very own subreddit! reddit.com/r/FutureMan)",,photo,https://www.facebook.com/reddit/photos/a.10150220507938735.343687.7177913734/10155886301993735/?type=3,2017-11-20 13:29:30,230,9,11,210,15,0,4,0,1,0
7177913734_130070814344312,"This event, featuring speakers from the Bay Area Women in Machine Learning & Data Science (@WiMLDS_BayArea), will include lightning talks from leading women in the tech industry specializing in machine learning & data science fields followed by an hour of networking and socializing. Speaker's topics will cover contributing to open source, building chatbots and using deep learning for Natural Language Processing (NLP). 

Agenda:

6:00-6:30 PM - Doors Open + Food & Drinks
6:30-6:50 PM - ""Contributing to Open Source Software: Why 
and How"" (Paula Alves)
6:50-7:10 PM - ""Enterprise to Computer: A Star Trek Chatbot"" (Grishma Jena)
7:10-7:30 PM - ""Applications for Natural Language Processing with Deep Learning"" (Anna Bethke)
7:30-8:30 PM - Networking",Women Talk Tech at Reddit,event,https://www.facebook.com/events/130070814344312/,2017-11-20 12:06:33,63,2,0,58,4,0,1,0,0,0
7177913734_10155876514028735,"It's that TIME of the year again... for a seasonal recap of redditors' best Thanksgiving memes!

time.com/5022126/funny-thanksgiving-memes-reddit-turkey/",Let's All Be Thankful for These Amazing Thanksgiving Memes,link,http://time.com/5022126/funny-thanksgiving-memes-reddit-turkey/,2017-11-17 12:23:31,74,4,2,68,2,0,4,0,0,0
7177913734_10155873619703735,"""Finally finished the Christmas decorations!""

Posted on r/funny by u/savage_irony: redd.it/7dc49s",,photo,https://www.facebook.com/reddit/photos/a.10150220507938735.343687.7177913734/10155873618388735/?type=3,2017-11-16 12:55:48,2383,189,285,1690,103,1,589,0,0,0
7177913734_10155871326898735,"r/aww has officially named a new cute subreddit of the week: r/trashpandas! 

If you haven't subscribed, here's your one-stop shop for baby trash pandas, neighborhood trash pandas, and even a trash panda reflecting on the choices that led him to one very embarrassing moment. 

(Posted by u/supercitron on redd.it/7cy1or)",,photo,https://www.facebook.com/reddit/photos/a.10150220507938735.343687.7177913734/10155871321813735/?type=3,2017-11-15 16:05:55,1136,163,87,879,120,2,131,1,1,2
7177913734_10155868026223735,"""$1175 wasn't enough, so I matched it :)""

An incredibly wholesome moment on r/WholesomeMemes yesterday. The subreddit raised $1175 for Children's Miracle Network Hospitals during Extra Life 2017, but nine-year redditor (and first-time commenter!) u/timjrobinson decided to match the entire community's donations last night, doubling their total!

reddit.com/r/wholesomememes/comments/7azxv9/we_did_it/dpsi4p7/",We did it! • r/wholesomememes,link,https://reddit.com/r/wholesomememes/comments/7azxv9/we_did_it/dpsi4p7/,2017-11-14 14:03:18,320,4,1,254,55,10,0,0,1,0
7177913734_10155867915188735,Cozmo's lost in Reddit! Check out the game and interactive livestream here: reddit.com/user/Anki_Inc,Help a real robot escape a physical manifestation of Reddit in a live game happening now. Play now just below these words. • r/promos,link,https://reddit.com/comments/7ct3se/help_a_real_robot_escape_a_physical_manifestation/,2017-11-14 13:16:04,93,2,3,85,4,1,2,1,0,0
7177913734_10155866571978735,"An adorable little robot named Cozmo is trapped inside Reddit! How will he ever escape? #thisisadvertising #nobamboozle 

reddit.com/user/Anki_Inc/comments/7cta9p/we_made_a_game_you_can_play_live_with_every/",We made a game you can play live with every Redditor on 11/14 called Cozmo Lost in Reddit. Here is the trailer. • u/Anki_Inc,link,https://reddit.com/user/Anki_Inc/comments/7cta9p/we_made_a_game_you_can_play_live_with_every/,2017-11-14 00:12:49,95,4,5,85,2,4,1,0,0,3
7177913734_10155866248688735,"""Ghostbusters casually stopped by my brother in law’s pizza place""

Posted on r/pics by u/Bvalentine90: redd.it/7cpwkm",,photo,https://www.facebook.com/reddit/photos/a.10150220507938735.343687.7177913734/10155866247928735/?type=3,2017-11-13 21:11:28,1385,21,25,1210,121,42,11,0,0,1
7177913734_10155865272118735,"Today, we’re excited to unveil a first look at Reddit Chat—in beta and coming soon to a Reddit near you! 

Read all about it in Mashable today: mashable.com/2017/11/13/reddit-chat/#2spLDpdTiOqV",,photo,https://www.facebook.com/reddit/photos/a.10150220507938735.343687.7177913734/10155865271453735/?type=3,2017-11-13 14:28:51,514,116,17,416,25,22,34,5,9,3
7177913734_10155856478968735,"""My girlfriend was out of town so my dog and I finally had the dinner we're always putting off""

Posted on r/pics by u/pablo902: redd.it/7c22c8",,photo,https://www.facebook.com/reddit/photos/a.10150220507938735.343687.7177913734/10155856478508735/?type=3,2017-11-10 14:46:43,2367,127,67,1796,199,2,366,0,1,3
7177913734_10155853757748735,"Teeny tiny popcorn, enormous sweet potatoes, head-scratching Hershey bars, and a Thanksgiving megathread from r/Cooking: TIME's latest Reddit roundup is a cornucopia filled with redditors' most interesting foods.

time.com/5013155/hershey-bar-internet-reactions-reddit/",The Internet Can’t Figure Out Hershey's Weird New Candy Bar,link,http://time.com/5013155/hershey-bar-internet-reactions-reddit/,2017-11-09 13:53:35,77,12,4,70,2,0,4,0,0,1
7177913734_10155853678778735,"ICYMI: Yesterday, our CEO and co-founder Steve Huffman took the stage at Web Summit 2017 to share a first look at the upcoming Reddit Redesign.

Check out the recap on our blog: redditblog.com/2017/11/08/an-update-on-reddits-redesign/",An Update on Reddit’s Redesign,link,https://redditblog.com/2017/11/08/an-update-on-reddits-redesign/,2017-11-09 13:15:07,116,14,7,105,7,3,0,0,1,0
7177913734_10155851058498735,"""me irl""

Posted on r/me_irl by u/DanielD3V: redd.it/7bkk32",,photo,https://www.facebook.com/reddit/photos/a.10150220507938735.343687.7177913734/10155851056903735/?type=3,2017-11-08 14:35:35,986,58,28,823,37,0,122,2,0,2
7177913734_10155846218803735,"“A friend in college who was here on an exchange program absolutely lost his shit when he saw those red solo cups at a party we were at. He could not believe they were real and not just ‘in the American movies.’ He took like 20 selfies with them.” —u/b8le

Yesterday in r/AskReddit, users from all over the world shared the best misconceptions they’ve heard about their countries. If you think Austria is filled with kangaroos and Denmark is the capital of IKEA, you might want to read this thread: redd.it/7b4jqv",What the best misconception about your country you've heard? • r/AskReddit,link,https://redd.it/7b4jqv,2017-11-07 13:00:00,867,40,42,644,15,1,206,0,0,1
7177913734_10155846162288735,"Don’t count your chickens before they turn into hawks.

Three months ago, u/treslilbirds bought a batch of “Easter eggers,” and one little chick turned into this majestic beast. (Warning: bird puns this way.) redd.it/7b5max",Photos from Reddit's post,photo,https://www.facebook.com/reddit/photos/a.10150220507938735.343687.7177913734/10155846107848735/?type=3,2017-11-07 12:00:00,515,45,40,385,29,15,86,0,0,0
7177913734_10155846104468735,"“Why such an overbuilt outhouse? Good question.” 

See how u/caducus turned two months of work and $3000 into the finest outhouse in the forest, in this epic post on r/DIY: redd.it/7b5bfe",Photos from Reddit's post,photo,https://www.facebook.com/reddit/photos/a.10150220507938735.343687.7177913734/10155846102128735/?type=3,2017-11-07 11:00:01,108,7,6,96,9,3,0,0,0,0
7177913734_10155846250783735,"""The objects authors most frequently use for size comparisons, past and present.""

Posted on r/dataisbeautiful by u/halfeatenscone:  redd.it/7abp33

(TIL: According to OP, using a banana for scale is statistically less common than more spherical fruits.)",,photo,https://www.facebook.com/reddit/photos/a.10150220507938735.343687.7177913734/10155846238833735/?type=3,2017-11-07 10:00:00,287,17,19,263,9,5,9,1,0,0
7177913734_10155846228733735,"""My friend’s breeder that she got her dog from has regular reunions for all the pups to meet back up - we need more positivity like this in the world""

Posted on r/aww by u/notrub95: redd.it/7b2123",,photo,https://www.facebook.com/reddit/photos/a.10150220507938735.343687.7177913734/10155846224633735/?type=3,2017-11-07 09:00:00,2525,307,109,1996,491,27,8,0,2,1
7177913734_10155845633958735,"""Good guy die manufacturer. Puts die in your die so when your die dies you have a new die""

Posted on r/pics: redd.it/7b06fl",,photo,https://www.facebook.com/reddit/photos/a.10150220507938735.343687.7177913734/10155845629858735/?type=3,2017-11-06 15:23:45,3460,152,268,2770,93,27,567,2,0,1
7177913734_10155840829673735,"We're still streaming live for Extra Life 2017! So far, Team Reddit has raised over $100,000 for Children's Miracle Network Hospitals, with over 1,000 players participating! 

Check out our Twitch stream here: twitch.tv/reddit
And head here for our donation page: extra-life.org/reddit",,photo,https://www.facebook.com/reddit/photos/a.10150220507938735.343687.7177913734/10155840824608735/?type=3,2017-11-04 20:03:35,109,0,8,96,9,1,1,0,0,2
7177913734_10155839905728735,"We're streaming live all day from Reddit HQ to raise money for #ExtraLife2017! 

Watch here: twitch.tv/reddit 
Donate here: extra-life.org/reddit",Reddit - Twitch,video,http://twitch.tv/reddit,2017-11-04 13:49:55,63,3,3,59,2,0,1,0,0,1
7177913734_10155839441123735,"""The goal is to raise $250,000, and I think we can do it, Reddit.""

Our co-founder Alexis Ohanian Sr. is kicking off our Extra Life 24-hour gaming marathon to raise money for Children's Miracle Network Hospitals, by streaming live on our Twitch channel right now! 

Watch here: twitch.tv/reddit
Donate here: extra-life.org/index.cfm?fuseaction=cms.page&id=1251",,photo,https://www.facebook.com/reddit/photos/a.10150220507938735.343687.7177913734/10155839430973735/?type=3,2017-11-04 10:47:57,109,5,1,94,10,3,0,0,0,2
7177913734_10155837598253735,"ICYMI: Sign-ups for this year's Reddit Gifts Secret Santa exchange are now open! 

If you've never participated before, here's a handy guide to doing your very first Secret Santa (and a few highlights from Santas Past): redditblog.com/2017/11/02/secret-santa-2017-join-a-reddit-tradition/

Or you can skip straight to the sign-ups here: redditgifts.com/exchanges/manage/#/exchange/secret-santa-2017/",Secret Santa 2017: Join a Reddit Tradition,link,https://redditblog.com/2017/11/02/secret-santa-2017-join-a-reddit-tradition/,2017-11-03 17:40:40,143,20,27,128,10,3,1,0,0,1
7177913734_10155833470423735,"Redditors' best Stranger Things fan theories and urban legends from r/AskReddit—check out the latest Reddit round-up from TIME! 

time.com/5005779/stranger-things-theories-2-reddit/",Here Are the 'Stranger Things' Theories the Internet Is Obsessing Over,link,http://time.com/5005779/stranger-things-theories-2-reddit/,2017-11-02 12:21:50,172,16,11,157,9,0,2,0,1,3
7177913734_10155833170018735,"Secret Santa sign-ups are officially open! Join us for our 9th annual holiday gift exchange, brought to you by Reddit Gifts! 

redditgifts.com/exchanges/manage/#/exchange/secret-santa-2017/",,photo,https://www.facebook.com/reddit/photos/a.10150220507938735.343687.7177913734/10155833163803735/?type=3,2017-11-02 10:27:28,182,21,29,169,9,3,0,0,0,1
7177913734_10155830961478735,"""I animated some classic Movie Quotes, with a twist!""

Watch u/nickmw's video on r/movies (60,000 upvotes and counting!): redd.it/7a2bwn",,photo,https://www.facebook.com/reddit/photos/a.10150220507938735.343687.7177913734/10155830956068735/?type=3,2017-11-01 15:27:58,260,17,22,215,5,1,37,0,0,2
7177913734_10155830678968735,"ICYMI: Warwick Davis, of Star Wars, Harry Potter, Willow, and Labyrinth fame, did an AMA this morning!

Check it out: redd.it/7a2qyy","I’m Warwick Davis. Ewok, Hogwarts Professor, Leprechaun, Tenable quiz show host…AMA! • r/IAmA",link,https://www.reddit.com/r/IAmA/comments/7a2qyy/im_warwick_davis_ewok_hogwarts_professor/,2017-11-01 13:34:27,367,14,16,325,35,5,0,1,0,1
